<?xml version="1.0" encoding="UTF-8"?>

<!DOCTYPE restaurante SYSTEM "ReglasRestaurante.dtd">

<restaurante>
    <menu>
        <plato id="p1">
            <nombre-plato>Croquetas</nombre-plato>
            <categoria>Carne</categoria>
            <ingredientes-menu>
                <ingrediente-menu>Pollo de puchero</ingrediente-menu>
            </ingredientes-menu>
            <precio moneda="EUR">6</precio>
        </plato>
    </menu>

    <recetas>
        <receta id="r1" comensales="adulto">
            <nombre-receta>Croquetas</nombre-receta>
            <ingredientes-receta>
                <ingrediente-receta cantidad="1" unidad="gramos">
                    <nombre-ingrediente-receta>Pollo de puchero</nombre-ingrediente-receta>
                </ingrediente-receta>
            </ingredientes-receta>
            <preparacion>
                <paso orden="1">Preparar croquetas.</paso>
                <paso orden="2">Servir croquetas.</paso>
            </preparacion>
        </receta>
    </recetas>

    <clientes>
        <cliente id="c1">
            <nombre-cliente>Samuel</nombre-cliente>
            <telefono>111 11 11 11</telefono>
            <mesa cantidad="2">11</mesa>
            <platos-consumidos>
                <plato-consumido comentario="Estaban buenÃ­simas las croquetas">
                    <nombre-plato-consumido>Croquetas</nombre-plato-consumido>
                    <cantidad>2</cantidad>
                </plato-consumido>
            </platos-consumidos>
        </cliente>
    </clientes>
</restaurante>